{
  "thread_id": "01jwqbm9k000000000000trance",
  "tier": "trance",
  "enforce": "fail-fast",
  "executor": "container",
  "steps": [
    {
      "step_id": "S0",
      "from": {"eidolon": "human",  "version": "n/a"},
      "to":   {"eidolon": "atlas",  "version": "1.12.1"},
      "performative": "REQUEST",
      "edge_origin": "roster",
      "objective": "Scout the Junction dispatch path and produce a seam report.",
      "artifact": {
        "kind": "prompt",
        "schema_version": "1.0",
        "path": "input/scout-prompt.md"
      },
      "model_tier_hint": "reasoning-class",
      "constraints": {"trust_level": "standard"}
    },
    {
      "step_id": "S1",
      "from": {"eidolon": "atlas",   "version": "1.12.1"},
      "to":   {"eidolon": "spectra", "version": "4.9.1"},
      "performative": "INFORM",
      "edge_origin": "roster",
      "objective": "Refine the scout findings into a decision-ready specification for F9-S0.",
      "model_tier_hint": "reasoning-class",
      "constraints": {"trust_level": "standard"}
    },
    {
      "step_id": "S2",
      "from": {"eidolon": "spectra", "version": "4.9.1"},
      "to":   {"eidolon": "apivr",   "version": "3.7.1"},
      "performative": "DELEGATE",
      "edge_origin": "roster",
      "objective": "Implement the plan.json ingestion seam per the round-6 spec.",
      "model_tier_hint": "reasoning-class",
      "constraints": {"trust_level": "standard"}
    }
  ]
}
